Site Type,Recorded Sites
"home industryblacksmith shop, rural domestic scatter, cemetery",1
"militaryentrenchment, artillery emplacement, large battlefield",1
"blacksmith shop, rural domestic house",1
"boat landing, cistern, untyped structure",1
"boat landing, rr spur",1
"boat wreck, other",1
"bottling plant, pump house",1
"bottling plant, store, tavern, boarding house, pharmacist's office",1
"bottling plant, well, cistern",1
brick kiln,1
"brickmaking, church, Urban domestic house, public cemetery, rr depot-spur-bridge, road, bridge, other",1
"bridge, untyped historic scatter",1
"camp meeting, cemetery",1
"cave, stone quarry, springhouse",1
"cave, stone wall",1
cavemoonshine still,1
"cavesaltpeter, grist mill, military long term encampment",1
"cavesaltpeter, military",1
"cavesaltpeter, pictograph",1
cavesaltpeter_moonshine still,1
cavestill,1
"cemetery, untyped historic scatter",1
boarding house,1
"blacksmith shop, rural domestic farmstead, cistern, untyped structure",1
"check dam, untyped historic scatter",1
blacksmith shop,1
Fish weir,1
Mine-Phosphate,1
"Public cemetery, military cemetery",1
Rural domestic untyped structure,1
"Urban domestic house, commercial",1
"Urban domestic house, isolated grave",1
"Urban domestic house, military",1
"Urban domestic house, private cemetery",1
"Urban domestic house, rr depot",1
Urban domestic scatter,1
"Urban domestic, abandoned town, cemetery",1
"Urban domestic, dump",1
"Urban domestic, home industrypottery",1
"Urban domestic, militaryshort term encampment",1
"Urban house, military",1
"abandoned town, health spa, rural domestic scatter",1
"abandoned town, house, well, road",1
"abandoned town, private cemetery",1
"abandoned town, rural domestic plantation, cemetery",1
check dam and bridge,1
"church, Urban domestic house",1
"home industryblacksmith shop, other",1
commercialtavern,1
"courthouse, well",1
"doctor's office, rural domestic scatter",1
"dump, untyped historic scatter",1
educational,1
"explosive magazine (non-military), ferry, road",1
"feed mill, commercialstore, warehouse, school, town, boat landing",1
"ferry, road",1
gold mine complex,1
"grist mill, rural domestic house",1
"grist mill, rural domestic house, barn",1
"grist mill, rural domestic house, farmstead, barn, well",1
historic petroglyph,1
"historic rockshelter, isolated grave, moonshine still",1
historic untyped stone structure,1
home industry,1
"home industry, rural domestic farmstead",1
"home industry, rural domestic untyped structure",1
"home industryblacksmith shop, commercial_store",1
"home industryblacksmith shop, farmstead, cemetery",1
"commercialtavern, inn",1
"commercialstore, tavern, inn, office, Urban house",1
"church, mission",1
"commercialstore, tavern, boarding house, Urban house",1
"church, school",1
"church, school, cemetery",1
"city office, school, hospital, cistern, military long term encampment and hospital",1
"commercial, military, other",1
"commercial, road, other",1
"commercial, rr spur",1
"commercial, rural domestic house",1
"commercial, rural domestic untyped structure",1
commercialboarding house,1
"commercialoffice, rural domestic house",1
"commercialpottery, school",1
"commercialpottery, school, church, parsonage, rural domestic farmstead, cemetery",1
"commercialstore, boarding house, inn, Urban house",1
"commercialstore, boat landing, ferry",1
"commercialstore, church, Urban house",1
"commercialstore, public_reservoir",1
"commercialstore, rural domestic house, well, untyped structure",1
"commercialstore, rural domestic untyped structure",1
"commercialstore, school",1
"militaryentrenchment, artillery emplacement, ferry, rural domestic house",1
"militaryentrenchment, large battlefield, cemetery, rural domestic farmstead",1
millsorghum,1
"militaryshort term encampment, rural domestic house, airfield",1
"militaryshort term encampment, rural domestic plantation, brick kiln, isolated grave",1
"militaryshort term encampment, rural domestic plantation, private cemetery",1
"militaryshort term encampment, short term hospital",1
"militaryshort term encampment, short term hospital, church",1
"militaryshort term encampment, untyped historic scatter",1
militaryshort term hospital,1
"militaryshort term hospital, CCC camp",1
"militaryshort term hospital, cemetery, church",1
"militaryshort term hospital, church",1
"militaryshort term hospital, headquarters, Urban house",1
"militaryshort term hospital, headquarters, rural domestic house",1
"militaryshort term hospital, home_industry_pottery, rural domestic farmstead",1
"militaryshort term hospital, mill_grist, rural domestic farmstead",1
"Commercial store, warehouse, Urban house",1
militarysignal station,1
"militarysignal station, rural domestic farmstead",1
"militarysmall battlefield, headquarters, Urban house",1
"militarysmall battlefield, long term encampment, headquarters, public cemetery",1
"militarysmall battlefield, medical_doctor's office, rural domestic_multiple features",1
"militaryshort term encampment, rural domestic plantation",1
"militaryshort term encampment, rural domestic house",1
"militarysmall battlefield, rural domestic house",1
"militaryshort term encampment, private cemetery",1
"militarymuster grounds, earthwork_entrenchment, large battlefield, long term encampment, signal station, house, road",1
"militarymuster grounds, inn, rural domestic house",1
militarypetroglyph,1
"militarypost, public cemetery, dump",1
"militaryredan, large battlefield, long term encampment, short term hospital, cemetery, boat landing",1
"militaryredan, rr guard post, long term encampment, short term hospital, headquarters, rural domestic farmstead, road",1
"militaryredoubt, long term encampment, headquarters",1
"militaryredoubt, rr guard post, headquarters",1
militaryroad,1
militaryrr bridge,1
"militaryrr guard post, bridge",1
"militaryrr guard post, long term encampment, mill_saw, distillery, fertilizer factory, rural domestic house",1
"militaryrr guard post, small battlefield, long term encampment",1
"militaryrr guard post, small battlefield, mill_saw, rural domestic house",1
"militaryrr guard post, small battlefield, short term hospital, college",1
"militaryshort term encampment, church",1
"militaryshort term encampment, internment center, airfield",1
"militaryshort term encampment, long term encampment",1
"militaryshort term encampment, long term encampment, ferry",1
"militarysmall battlefield, public cemetery",1
"militarysmall battlefield, short term encampment, rural domestic farmstead, private cemetery",1
"militarymultiple features, university",1
"millgrist, saw, feed",1
"millgrist, saw, stone quarry, store, post office, rural domestic farmstead",1
"millgrist, store, ferry",1
"millgrist, store, post office, farmstead",1
"millgrist, store, school",1
"millgrist, wagonmaking shop, commercial_store, town",1
"millindeterminate, road",1
"millindeterminate, rural domestic house",1
millpowder,1
"millsaw, blacksmith shop, tanyard, cotton gin, town",1
"millsaw, brickmaking, well",1
"millsaw, check dam",1
"millsaw, cobbling shop, store, post office, church, town, cemetery, boat landing, dam, road",1
"millsaw, cotton gin, store, town",1
"millsaw, rr depot",1
"millsaw, rural domestic farmstead",1
"millsaw, rural domestic house, well",1
"millsaw, rural domestic scatter",1
"millsaw, school",1
"millsaw, woolen, iron_forge, cotton gin, blacksmith shop, store, town",1
"millgrist, saw, stone quarry, rural domestic farmstead_multiple features",1
"millgrist, rural domestic untyped structure, other",1
"militarysmall battlefield, short term encampment, rural domestic springhouse, cistern, road, rock shelter",1
"millgrist, rural domestic untyped structure",1
"militarysmall battlefield, short term encampment, short term hosptal, cemetery",1
"militarysmall battlefield, short term hospital, cemetery, church,",1
"militarystockade, earthwork, redan, state capitol",1
"militarystockade, rr guard post, long term encampment,",1
"militarystockade, rr guard post, small battlefield, cemetery",1
millfeed,1
"millgrist, blacksmith shop, gunsmith, store, rural domestic farmstead",1
"millgrist, brick kiln, rural domestic house",1
"millgrist, cobbling shop, store",1
"millgrist, distillery",1
"millgrist, home industry_cotton gin",1
"millgrist, home industry_pottery",1
"millgrist, iron forge",1
"millgrist, lock-dam",1
"millgrist, mill_powder, moonshine still",1
"millgrist, mill_saw, blacksmith shop",1
"millgrist, mill_woolen, iron_forge",1
"millgrist, pump house",1
"millgrist, rural domestic scatter",1
"militarymuster grounds, Urban house",1
"militarylong term hospital, school",1
"militaryentrenchment, large battlefield, short term encampment",1
"militaryfort, earthwork, small battlefield",1
"militaryfort, entrenchment, artillery emplacement, large battlefield, long term encampment, explosive magazine, rural domestic house, public cemetery",1
"militaryfort, entrenchment, long term encampment",1
"militaryfort, entrenchment, lunette",1
"militaryfort, entrenchment, redoubt, long term encampment, explosive magazine, private cemetery",1
"militaryfort, entrenchment, redoubt, long term encampment, headquarters, mine_coal",1
"militaryfort, entrenchment, redoubt, small battlefield, long term encampment, signal station, explosive magazine, rural domestic house",1
"militaryfort, entrenchment, small battlefield, long term encampment, cemetery",1
"militaryfort, long term encampment, cemetery",1
"militaryfort, prison",1
"militaryfort, redoubt, rr guard post",1
"militaryfort, short term encampment",1
"militaryfort, small battlefield",1
"militaryfort, small battlefield, long term encampment, headquarters, Urban house",1
"militaryfort, stockade, redoubt, rr guard post, small battlefield, long term encampment, mill_saw",1
militaryfort_encampment_contraband_earthwork_cemetery,1
"militaryfrontier station, blacksmith shop, rural domestic house, private cemetery",1
"militaryfrontier station, blockhouse, cemetery, rural domestic farmstead",1
"militaryfrontier station, blockhouse, headquarters",1
"militaryfrontier station, blockhouse, mill_grist, bridge",1
"militaryfort, earthwork, small battlefield, long term encampment",1
"militaryfort, earthwork, rr guard post, long term encampment",1
"militaryfrontier station, blockhouse, small battlefield, cemetery, rural domestic house",1
"militaryfort, earthwork, rr guard post",1
"militaryentrenchment, large battlefield, short term hospital, headquarters, rural domestic farmstead, cotton gin",1
"militaryentrenchment, redan, long term encampment, headquarters, signal station, public cemetery",1
"militaryentrenchment, redoubt, long term encampment",1
"militaryentrenchment, redoubt, rr guard post",1
"militaryentrenchment, redoubt, small battlefield, long term encampment, Urban house, abandoned town, cemetery, rr depot",1
"militaryentrenchment, short term encampment, airfield, rural domestic house",1
"militaryentrenchment, short term encampment, short term hopsital",1
"militaryentrenchment, small battlefield, long term encampment, headquarters, rural domestic house",1
militaryexplosive magazine,1
"militaryfort, abandoned town, ferry",1
"militaryfort, earthwork, artillery emplacement, large battlefield",1
"militaryfort, earthwork, artillery emplacement, road",1
"militaryfort, earthwork, entrenchment, small battlefield, long term encampment",1
"militaryfort, earthwork, long term encampment",1
"militaryfort, earthwork, lunette",1
"militaryfort, earthwork, lunette, rr guard post",1
"militaryfort, earthwork, redoubt",1
"militaryfort, earthwork, redoubt, large battlefield",1
"militaryfort, earthwork, redoubt, long term encampment",1
"militaryfrontier station, blockhouse, private cemetery",1
"militaryfrontier station, courthouse",1
"militarylong term hospital, rural domestic house",1
"militarylarge battlefield, cemetery",1
"militarylarge battlefield, short term encampment, cemetery, isolated grave",1
"militarylarge battlefield, short term hospital, cemetery, rural domestic house",1
"militarylarge battlefield, short term hospital, cemetery, rural domestic plantation",1
"militarylarge battlefield, short term hospital, rural domestic farmstead",1
"militarylong term encampment, cemetery",1
"militarylong term encampment, headquarters, rural domestic house",1
"militarylong term encampment, headquarters, town",1
"militarylong term encampment, long term hospital, headquarters, Urban domestic house",1
"militarylong term encampment, mill_grist, blacksmith shop, store, rural domestic house",1
"militarylong term encampment, other",1
"militarylong term encampment, private cemetery",1
"militarylong term encampment, rural domestic house",1
"militarylong term encampment, rural domestic house, farmstead, private cemetery",1
"militarylong term encampment, shipyard",1
"militarylong term encampment, small battlefield, headquarters, rural domestic plantation",1
"militarylong term encampment, tavern, rural domestic farmstead",1
"militarylong term hopsital, university",1
"militarylong term hospital, cemetery, academy",1
"militarylong term hospital, headquarters, signal station, courthouse",1
"militarylarge battlefield, rural domestic house",1
militaryisolated grave,1
"militaryfrontier station, ferry",1
"militaryinternment center, long term hospital, headquarters, military post",1
"militaryfrontier station, fort, mill_grist",1
"militaryfrontier station, fort, rural domestic farmstead",1
"militaryfrontier station, fort, rural domestic house",1
"militaryfrontier station, large battlefield, short term hospital, inn, rural domestic farmstead",1
"militaryfrontier station, mill_grist, rural domestic house, cemetery",1
"militaryfrontier station, mill_grist, rural domestic house, private cemetery",1
"militaryfrontier station, muster grounds",1
"militaryfrontier station, private cemetery",1
"militaryfrontier station, rural domestic untyped structure",1
"militaryfrontier station, short term hospital, store, post office, rural domestic house",1
"militaryfrontier station, small battlefield",1
"militaryfrontier station, small battlefield, mill_grist",1
"militaryfrontier station, small battlefield, rural domestic farmstead",1
"militaryfrontier station, small battlefield, rural domestic farmstead, mill, cemetery",1
"militaryfrontier station, small battlefield, rural domestic house",1
"militaryheadquarters, Urban house",1
"militaryheadquarters, rural domestic plantation",1
"militaryheadquarters, university",1
militaryinternment center,1
untyped structure - stone,1
